{
  "$schema": "./schemas/manual-coverage.schema.json",
  "sourceId": "cfbenchmarks-rest-manual",
  "fixtureId": "cfbenchmarks.rest-cases",
  "entries": [
    {
      "manualEntryId": "cfbenchmarks.values",
      "contractId": "cfbenchmarks.values",
      "fixtureId": "cfbenchmarks.rest-cases",
      "caseIds": [
        "cfbenchmarks-rest-manual:request-0",
        "cfbenchmarks-rest-manual:signing-0",
        "cfbenchmarks-rest-manual:missing-credentials",
        "cfbenchmarks-rest-manual:signing-query-in-preimage",
        "cfbenchmarks-rest-manual:signing-wrong-method",
        "cfbenchmarks-rest-manual:signing-wrong-path",
        "cfbenchmarks-rest-manual:mapping-not-found-true",
        "cfbenchmarks-rest-manual:mapping-not-found-false",
        "cfbenchmarks-rest-manual:mapping-rate-limit-true",
        "cfbenchmarks-rest-manual:mapping-rate-limit-false",
        "cfbenchmarks-rest-manual:mapping-authorization-true",
        "cfbenchmarks-rest-manual:mapping-authorization-false",
        "cfbenchmarks-rest-manual:mapping-server-true",
        "cfbenchmarks-rest-manual:mapping-server-false",
        "cfbenchmarks-rest-manual:mapping-timeout-true",
        "cfbenchmarks-rest-manual:mapping-timeout-false",
        "cfbenchmarks-rest-manual:mapping-client-true",
        "cfbenchmarks-rest-manual:mapping-client-false",
        "cfbenchmarks-rest-manual:metadata-positive",
        "cfbenchmarks-rest-manual:metadata-wrong-cost",
        "cfbenchmarks-rest-manual:metadata-wrong-method",
        "cfbenchmarks-rest-manual:metadata-wrong-auth",
        "cfbenchmarks-rest-manual:metadata-wrong-prefix"
      ]
    },
    {
      "manualEntryId": "cfbenchmarks.history-values",
      "contractId": "cfbenchmarks.history-values",
      "fixtureId": "cfbenchmarks.rest-cases",
      "caseIds": [
        "cfbenchmarks-rest-manual:request-1",
        "cfbenchmarks-rest-manual:signing-1",
        "cfbenchmarks-rest-manual:envelope-object",
        "cfbenchmarks-rest-manual:envelope-array",
        "cfbenchmarks-rest-manual:envelope-string",
        "cfbenchmarks-rest-manual:envelope-number",
        "cfbenchmarks-rest-manual:envelope-boolean",
        "cfbenchmarks-rest-manual:envelope-null",
        "cfbenchmarks-rest-manual:envelope-missing-data",
        "cfbenchmarks-rest-manual:envelope-array-root",
        "cfbenchmarks-rest-manual:envelope-null-root"
      ]
    },
    {
      "manualEntryId": "cfbenchmarks.passthrough",
      "contractId": "cfbenchmarks.passthrough",
      "fixtureId": "cfbenchmarks.rest-cases",
      "caseIds": [
        "cfbenchmarks-rest-manual:request-2",
        "cfbenchmarks-rest-manual:signing-2",
        "cfbenchmarks-rest-manual:request-unicode",
        "cfbenchmarks-rest-manual:request-pairs",
        "cfbenchmarks-rest-manual:request-ignore",
        "cfbenchmarks-rest-manual:request-empty-query",
        "cfbenchmarks-rest-manual:path-0",
        "cfbenchmarks-rest-manual:path-1",
        "cfbenchmarks-rest-manual:path-2",
        "cfbenchmarks-rest-manual:path-3",
        "cfbenchmarks-rest-manual:path-4",
        "cfbenchmarks-rest-manual:path-5",
        "cfbenchmarks-rest-manual:path-6",
        "cfbenchmarks-rest-manual:path-7",
        "cfbenchmarks-rest-manual:path-8",
        "cfbenchmarks-rest-manual:path-9",
        "cfbenchmarks-rest-manual:path-10",
        "cfbenchmarks-rest-manual:path-11",
        "cfbenchmarks-rest-manual:path-12",
        "cfbenchmarks-rest-manual:path-13",
        "cfbenchmarks-rest-manual:path-14",
        "cfbenchmarks-rest-manual:path-15",
        "cfbenchmarks-rest-manual:path-16",
        "cfbenchmarks-rest-manual:path-17",
        "cfbenchmarks-rest-manual:path-18",
        "cfbenchmarks-rest-manual:path-19",
        "cfbenchmarks-rest-manual:query-0",
        "cfbenchmarks-rest-manual:query-1",
        "cfbenchmarks-rest-manual:query-2",
        "cfbenchmarks-rest-manual:query-3",
        "cfbenchmarks-rest-manual:query-4",
        "cfbenchmarks-rest-manual:query-5",
        "cfbenchmarks-rest-manual:error-json",
        "cfbenchmarks-rest-manual:error-text",
        "cfbenchmarks-rest-manual:error-binary",
        "cfbenchmarks-rest-manual:error-empty",
        "cfbenchmarks-rest-manual:error-not-found",
        "cfbenchmarks-rest-manual:error-rate-limit",
        "cfbenchmarks-rest-manual:error-unavailable",
        "cfbenchmarks-rest-manual:error-bad-request"
      ]
    }
  ],
  "pendingTargets": [
    {
      "targetId": "typescript.KalshiTS",
      "status": "pending-sdk-support",
      "contractIds": [
        "cfbenchmarks.values",
        "cfbenchmarks.history-values",
        "cfbenchmarks.passthrough"
      ],
      "fixtureIds": [
        "cfbenchmarks.rest-cases"
      ],
      "caseIds": [
        "cfbenchmarks-rest-manual:request-0",
        "cfbenchmarks-rest-manual:signing-0",
        "cfbenchmarks-rest-manual:request-1",
        "cfbenchmarks-rest-manual:signing-1",
        "cfbenchmarks-rest-manual:request-2",
        "cfbenchmarks-rest-manual:signing-2",
        "cfbenchmarks-rest-manual:request-unicode",
        "cfbenchmarks-rest-manual:request-pairs",
        "cfbenchmarks-rest-manual:request-ignore",
        "cfbenchmarks-rest-manual:request-empty-query",
        "cfbenchmarks-rest-manual:path-0",
        "cfbenchmarks-rest-manual:path-1",
        "cfbenchmarks-rest-manual:path-2",
        "cfbenchmarks-rest-manual:path-3",
        "cfbenchmarks-rest-manual:path-4",
        "cfbenchmarks-rest-manual:path-5",
        "cfbenchmarks-rest-manual:path-6",
        "cfbenchmarks-rest-manual:path-7",
        "cfbenchmarks-rest-manual:path-8",
        "cfbenchmarks-rest-manual:path-9",
        "cfbenchmarks-rest-manual:path-10",
        "cfbenchmarks-rest-manual:path-11",
        "cfbenchmarks-rest-manual:path-12",
        "cfbenchmarks-rest-manual:path-13",
        "cfbenchmarks-rest-manual:path-14",
        "cfbenchmarks-rest-manual:path-15",
        "cfbenchmarks-rest-manual:path-16",
        "cfbenchmarks-rest-manual:path-17",
        "cfbenchmarks-rest-manual:path-18",
        "cfbenchmarks-rest-manual:path-19",
        "cfbenchmarks-rest-manual:query-0",
        "cfbenchmarks-rest-manual:query-1",
        "cfbenchmarks-rest-manual:query-2",
        "cfbenchmarks-rest-manual:query-3",
        "cfbenchmarks-rest-manual:query-4",
        "cfbenchmarks-rest-manual:query-5",
        "cfbenchmarks-rest-manual:missing-credentials",
        "cfbenchmarks-rest-manual:signing-query-in-preimage",
        "cfbenchmarks-rest-manual:signing-wrong-method",
        "cfbenchmarks-rest-manual:signing-wrong-path",
        "cfbenchmarks-rest-manual:envelope-object",
        "cfbenchmarks-rest-manual:envelope-array",
        "cfbenchmarks-rest-manual:envelope-string",
        "cfbenchmarks-rest-manual:envelope-number",
        "cfbenchmarks-rest-manual:envelope-boolean",
        "cfbenchmarks-rest-manual:envelope-null",
        "cfbenchmarks-rest-manual:envelope-missing-data",
        "cfbenchmarks-rest-manual:envelope-array-root",
        "cfbenchmarks-rest-manual:envelope-null-root",
        "cfbenchmarks-rest-manual:mapping-not-found-true",
        "cfbenchmarks-rest-manual:mapping-not-found-false",
        "cfbenchmarks-rest-manual:mapping-rate-limit-true",
        "cfbenchmarks-rest-manual:mapping-rate-limit-false",
        "cfbenchmarks-rest-manual:mapping-authorization-true",
        "cfbenchmarks-rest-manual:mapping-authorization-false",
        "cfbenchmarks-rest-manual:mapping-server-true",
        "cfbenchmarks-rest-manual:mapping-server-false",
        "cfbenchmarks-rest-manual:mapping-timeout-true",
        "cfbenchmarks-rest-manual:mapping-timeout-false",
        "cfbenchmarks-rest-manual:mapping-client-true",
        "cfbenchmarks-rest-manual:mapping-client-false",
        "cfbenchmarks-rest-manual:error-json",
        "cfbenchmarks-rest-manual:error-text",
        "cfbenchmarks-rest-manual:error-binary",
        "cfbenchmarks-rest-manual:error-empty",
        "cfbenchmarks-rest-manual:error-not-found",
        "cfbenchmarks-rest-manual:error-rate-limit",
        "cfbenchmarks-rest-manual:error-unavailable",
        "cfbenchmarks-rest-manual:error-bad-request",
        "cfbenchmarks-rest-manual:metadata-positive",
        "cfbenchmarks-rest-manual:metadata-wrong-cost",
        "cfbenchmarks-rest-manual:metadata-wrong-method",
        "cfbenchmarks-rest-manual:metadata-wrong-auth",
        "cfbenchmarks-rest-manual:metadata-wrong-prefix"
      ]
    },
    {
      "targetId": "rust.kalshi-rs",
      "status": "pending-sdk-support",
      "contractIds": [
        "cfbenchmarks.values",
        "cfbenchmarks.history-values",
        "cfbenchmarks.passthrough"
      ],
      "fixtureIds": [
        "cfbenchmarks.rest-cases"
      ],
      "caseIds": [
        "cfbenchmarks-rest-manual:request-0",
        "cfbenchmarks-rest-manual:signing-0",
        "cfbenchmarks-rest-manual:request-1",
        "cfbenchmarks-rest-manual:signing-1",
        "cfbenchmarks-rest-manual:request-2",
        "cfbenchmarks-rest-manual:signing-2",
        "cfbenchmarks-rest-manual:request-unicode",
        "cfbenchmarks-rest-manual:request-pairs",
        "cfbenchmarks-rest-manual:request-ignore",
        "cfbenchmarks-rest-manual:request-empty-query",
        "cfbenchmarks-rest-manual:path-0",
        "cfbenchmarks-rest-manual:path-1",
        "cfbenchmarks-rest-manual:path-2",
        "cfbenchmarks-rest-manual:path-3",
        "cfbenchmarks-rest-manual:path-4",
        "cfbenchmarks-rest-manual:path-5",
        "cfbenchmarks-rest-manual:path-6",
        "cfbenchmarks-rest-manual:path-7",
        "cfbenchmarks-rest-manual:path-8",
        "cfbenchmarks-rest-manual:path-9",
        "cfbenchmarks-rest-manual:path-10",
        "cfbenchmarks-rest-manual:path-11",
        "cfbenchmarks-rest-manual:path-12",
        "cfbenchmarks-rest-manual:path-13",
        "cfbenchmarks-rest-manual:path-14",
        "cfbenchmarks-rest-manual:path-15",